{
  "$schema": "https://rmside.invalid/schemas/certified-constructs/v1",
  "schemaVersion": "1.0.0",
  "compatibility": {
    "minimumMajor": 1,
    "maximumMajor": 1
  },
  "profileId": "aoe2de-101.103.57257-rms-v1",
  "derivationContract": "aoe2de-native-capture-executed-constructs-v1",
  "entries": [
    {
      "tableId": "aoe2de-101.103.57257.0-certified-constructs-v1",
      "productVersion": "101.103.57257.0",
      "source": "matched-native-captures",
      "provenance": {
        "tool": "tools/derive-certified-constructs.mjs",
        "nativeBuild": "101.103.57257.0",
        "matchedCases": 23,
        "executionsSha256": "a71c449388f668c44ecb5d0e9d005ce0528f9f5788c0a1585493e5e773a3b5f3",
        "derivedOn": "2026-10-28"
      },
      "constructs": [
        { "context": "", "name": "effect_amount" },
        { "context": "", "name": "effect_percent" },
        { "context": "", "name": "override_map_size" },
        { "context": "<CLIFF_GENERATION>", "name": "cliff_curliness" },
        { "context": "<CLIFF_GENERATION>", "name": "cliff_type" },
        { "context": "<CLIFF_GENERATION>", "name": "max_length_of_cliff" },
        { "context": "<CLIFF_GENERATION>", "name": "max_number_of_cliffs" },
        { "context": "<CLIFF_GENERATION>", "name": "min_distance_cliffs" },
        { "context": "<CLIFF_GENERATION>", "name": "min_length_of_cliff" },
        { "context": "<CLIFF_GENERATION>", "name": "min_number_of_cliffs" },
        { "context": "<CLIFF_GENERATION>", "name": "min_terrain_distance" },
        { "context": "<CONNECTION_GENERATION>", "name": "accumulate_connections" },
        { "context": "<CONNECTION_GENERATION>", "name": "create_connect_all_lands" },
        { "context": "<CONNECTION_GENERATION>", "name": "create_connect_all_players_land" },
        { "context": "<CONNECTION_GENERATION>", "name": "create_connect_teams_lands" },
        { "context": "<ELEVATION_GENERATION>", "name": "create_elevation" },
        { "context": "<LAND_GENERATION>", "name": "base_terrain" },
        { "context": "<LAND_GENERATION>", "name": "create_land" },
        { "context": "<LAND_GENERATION>", "name": "create_player_lands" },
        { "context": "<LAND_GENERATION>", "name": "enable_waves" },
        { "context": "<OBJECTS_GENERATION>", "name": "create_object" },
        { "context": "<OBJECTS_GENERATION>", "name": "create_object_group" },
        { "context": "<OBJECTS_GENERATION>", "name": "effect_amount" },
        { "context": "<PLAYER_SETUP>", "name": "ai_info_map_type" },
        { "context": "<PLAYER_SETUP>", "name": "behavior_version" },
        { "context": "<PLAYER_SETUP>", "name": "direct_placement" },
        { "context": "<PLAYER_SETUP>", "name": "effect_amount" },
        { "context": "<PLAYER_SETUP>", "name": "enable_waves" },
        { "context": "<PLAYER_SETUP>", "name": "force_nomad_treaty" },
        { "context": "<PLAYER_SETUP>", "name": "grouped_by_team" },
        { "context": "<PLAYER_SETUP>", "name": "nomad_resources" },
        { "context": "<PLAYER_SETUP>", "name": "random_placement" },
        { "context": "<PLAYER_SETUP>", "name": "set_gaia_civilization" },
        { "context": "<PLAYER_SETUP>", "name": "water_definition" },
        { "context": "<TERRAIN_GENERATION>", "name": "color_correction" },
        { "context": "<TERRAIN_GENERATION>", "name": "create_terrain" },
        { "context": "create_connect_all_lands", "name": "replace_terrain" },
        { "context": "create_connect_all_lands", "name": "terrain_cost" },
        { "context": "create_connect_all_lands", "name": "terrain_size" },
        { "context": "create_connect_all_players_land", "name": "replace_terrain" },
        { "context": "create_connect_all_players_land", "name": "terrain_cost" },
        { "context": "create_connect_all_players_land", "name": "terrain_size" },
        { "context": "create_connect_teams_lands", "name": "replace_terrain" },
        { "context": "create_connect_teams_lands", "name": "terrain_cost" },
        { "context": "create_connect_teams_lands", "name": "terrain_size" },
        { "context": "create_elevation", "name": "base_terrain" },
        { "context": "create_elevation", "name": "enable_balanced_elevation" },
        { "context": "create_elevation", "name": "number_of_clumps" },
        { "context": "create_elevation", "name": "number_of_tiles" },
        { "context": "create_elevation", "name": "set_scale_by_groups" },
        { "context": "create_elevation", "name": "set_scale_by_size" },
        { "context": "create_elevation", "name": "spacing" },
        { "context": "create_land", "name": "assign_to" },
        { "context": "create_land", "name": "base_elevation" },
        { "context": "create_land", "name": "base_size" },
        { "context": "create_land", "name": "border_fuzziness" },
        { "context": "create_land", "name": "bottom_border" },
        { "context": "create_land", "name": "clumping_factor" },
        { "context": "create_land", "name": "land_id" },
        { "context": "create_land", "name": "land_percent" },
        { "context": "create_land", "name": "land_position" },
        { "context": "create_land", "name": "left_border" },
        { "context": "create_land", "name": "number_of_tiles" },
        { "context": "create_land", "name": "other_zone_avoidance_distance" },
        { "context": "create_land", "name": "right_border" },
        { "context": "create_land", "name": "set_circular_base" },
        { "context": "create_land", "name": "terrain_type" },
        { "context": "create_land", "name": "top_border" },
        { "context": "create_land", "name": "zone" },
        { "context": "create_object", "name": "actor_area" },
        { "context": "create_object", "name": "actor_area_radius" },
        { "context": "create_object", "name": "actor_area_to_place_in" },
        { "context": "create_object", "name": "avoid_actor_area" },
        { "context": "create_object", "name": "avoid_cliff_zone" },
        { "context": "create_object", "name": "avoid_forest_zone" },
        { "context": "create_object", "name": "avoid_other_land_zones" },
        { "context": "create_object", "name": "enable_tile_shuffling" },
        { "context": "create_object", "name": "find_closest" },
        { "context": "create_object", "name": "find_closest_to_map_center" },
        { "context": "create_object", "name": "find_closest_to_map_edge" },
        { "context": "create_object", "name": "group_placement_radius" },
        { "context": "create_object", "name": "group_variance" },
        { "context": "create_object", "name": "ignore_terrain_restrictions" },
        { "context": "create_object", "name": "layer_to_place_on" },
        { "context": "create_object", "name": "make_indestructible" },
        { "context": "create_object", "name": "max_distance_to_other_zones" },
        { "context": "create_object", "name": "max_distance_to_players" },
        { "context": "create_object", "name": "min_distance_group_placement" },
        { "context": "create_object", "name": "min_distance_to_map_edge" },
        { "context": "create_object", "name": "min_distance_to_players" },
        { "context": "create_object", "name": "number_of_groups" },
        { "context": "create_object", "name": "number_of_objects" },
        { "context": "create_object", "name": "place_on_forest_zone" },
        { "context": "create_object", "name": "place_on_specific_land_id" },
        { "context": "create_object", "name": "require_path" },
        { "context": "create_object", "name": "resource_delta" },
        { "context": "create_object", "name": "second_object" },
        { "context": "create_object", "name": "set_building_capturable" },
        { "context": "create_object", "name": "set_circular_placement" },
        { "context": "create_object", "name": "set_facet" },
        { "context": "create_object", "name": "set_gaia_object_only" },
        { "context": "create_object", "name": "set_gaia_unconvertible" },
        { "context": "create_object", "name": "set_loose_grouping" },
        { "context": "create_object", "name": "set_place_for_every_player" },
        { "context": "create_object", "name": "set_scaling_to_map_size" },
        { "context": "create_object", "name": "set_scaling_to_player_number" },
        { "context": "create_object", "name": "set_tight_grouping" },
        { "context": "create_object", "name": "temp_min_distance_group_placement" },
        { "context": "create_object", "name": "terrain_to_place_on" },
        { "context": "create_object_group", "name": "add_object" },
        { "context": "create_player_lands", "name": "base_elevation" },
        { "context": "create_player_lands", "name": "base_size" },
        { "context": "create_player_lands", "name": "border_fuzziness" },
        { "context": "create_player_lands", "name": "bottom_border" },
        { "context": "create_player_lands", "name": "circle_radius" },
        { "context": "create_player_lands", "name": "clumping_factor" },
        { "context": "create_player_lands", "name": "land_id" },
        { "context": "create_player_lands", "name": "land_percent" },
        { "context": "create_player_lands", "name": "left_border" },
        { "context": "create_player_lands", "name": "number_of_tiles" },
        { "context": "create_player_lands", "name": "other_zone_avoidance_distance" },
        { "context": "create_player_lands", "name": "right_border" },
        { "context": "create_player_lands", "name": "set_zone_by_team" },
        { "context": "create_player_lands", "name": "set_zone_randomly" },
        { "context": "create_player_lands", "name": "terrain_type" },
        { "context": "create_player_lands", "name": "top_border" },
        { "context": "create_player_lands", "name": "zone" },
        { "context": "create_terrain", "name": "base_terrain" },
        { "context": "create_terrain", "name": "beach_terrain" },